{
  "report_id": "VSA-REPORT-INTEGRATED-001",
  "overall_evidence_strength": "preliminary",
  "claims": [
    {
      "claim_id": "C1",
      "text": "Condition B shows a preliminary signal in initial measurements.",
      "evidence_level": "preliminary"
    }
  ],
  "validation_results": {
    "literature_supported": false,
    "preliminary_experimental": true
  },
  "warnings": [
    "Evidence is preliminary and not replicated."
  ],
  "human_review": null,
  "evidence_links": [
    {
      "link_id": "L1",
      "claim_id": "C1",
      "source_type": "experiment",
      "source_ref": "RUN-001",
      "weight": 0.6
    }
  ]
}